Id,Subject,IsDeleted,MasterRecordId,CaseNumber,ContactId,AccountId,SourceId,ParentId,SuppliedName,SuppliedEmail,SuppliedPhone,SuppliedCompany,Type,Status,Reason,Origin,Priority,Description,IsClosed,ClosedDate,IsEscalated,ContactPhone,ContactMobile,ContactEmail,ContactFax,Comments,LastViewedDate,LastReferencedDate,FinServ__FinancialAccount__c,MasterRecord.Subject,Account.Name,Source.Name,Parent.Subject,FinServ__FinancialAccount__r.Name,Contact.$$Name$AccountId
5003h000005EwMnAAK,Can not access Tax Documents (Sample),false,,00001006,0033h000008s54yAAA,0013h00000CviBAAAZ,,,,,,,Question,Escalated,Instructions not clear,Email,Medium,"Rachel's email:

The email you sent did not contain the password for the tax documents. Could you please email that to me? Thanks.",false,,false,(500) 145-0557,5001450558,rachel@acmecorp.com,,,,,,,Rachel Adams (Sample),,,,Rachel Adams (Sample);0013h00000CviBAAAZ
5003h000005EwMlAAK,Can not access Legal Documents (Sample),false,,00001008,0033h000008s54zAAA,0013h00000CviB9AAJ,,,,,,,Question,New,Instructions not clear,Phone,Medium,"Nigel's email:

The email you sent did not contain the password for the Legal documents. Could you please email that to me? Thanks.",false,,false,,,,,,,,,,Nigel Adams (Sample),,,,Nigel Adams (Sample);0013h00000CviB9AAJ
5003h000005EwMmAAK,Instruction Not Clear,false,,00001009,0033h000008s552AAA,0013h00000CviB7AAJ,,,,,,,,New,Instructions not clear,Email,Medium,,false,,false,(541) 754-3010,,adamr@mikcorp.com,,,,,,,Aaron Thompson (Sample),,,,Aaron Thompson (Sample);0013h00000CviB7AAJ
5003h000005EwMkAAK,Cannot access details(Sample),false,,00001007,0033h000008s552AAA,0013h00000CviB7AAJ,,,,,,,Question,Closed,Instructions not clear,Email,Medium,,true,2021-07-28T15:40:21.000+0000,false,(541) 754-3010,,adamr@mikcorp.com,,,,,,,Aaron Thompson (Sample),,,,Aaron Thompson (Sample);0013h00000CviB7AAJ
